{
  "run_id": "20260930-110042-proposal",
  "doc_type": "proposal",
  "contract": {
    "goal": "document.json که همه‌ی ردیف‌های روبریک «پروپوزال فروش و اجرای پروژه» را با شاهد پوشش دهد و هیچ رد فوری نداشته باشد",
    "criteria": "نمره‌ی Loop = total ÷ ۱۰ از gate.v<n>.json؛ هدف: قبولی راهنما و total > ۹۰",
    "acceptable_risks": [
      "[نامعلوم]هایی که در gaps.json ثبت شده‌اند (به شرط اعلام نکردن «آماده امضا»)"
    ],
    "unacceptable_risks": [
      "هر رد فوری",
      "ادعای واقعی بی‌منبع",
      "جمع قیمت غلط"
    ],
    "authority_system": [
      "بازنویسی",
      "انتخاب نسخه‌ی پایه",
      "توقف"
    ],
    "authority_human": [
      "ارسال",
      "تأیید نهایی",
      "تغییر روبریک یا گلدن‌ست",
      "پذیرش سند زیر هدف"
    ]
  },
  "config": {
    "max_rounds": 4,
    "total_gt": 90.0,
    "plateau_rounds": 2,
    "plateau_min_gain": 1.0
  },
  "rounds": [
    {
      "round": 1,
      "version": 1,
      "base_version": null,
      "total": 57.5,
      "score10": 5.75,
      "guide_pass": false,
      "target_met": false,
      "veto": [],
      "below_target": [
        "R01",
        "R02",
        "R03",
        "R04",
        "R05",
        "R06",
        "R07",
        "R08",
        "R09",
        "R10"
      ],
      "limited_by_input": false,
      "decision": "continue",
      "reason": "هدف برآورده نشد؛ دور بعد روی نسخه‌ی پایه‌ی ۱",
      "best_version_after": 1
    },
    {
      "round": 2,
      "version": 2,
      "base_version": 1,
      "total": 55.0,
      "score10": 5.5,
      "guide_pass": false,
      "target_met": false,
      "veto": [],
      "below_target": [
        "R01",
        "R02",
        "R03",
        "R04",
        "R05",
        "R06",
        "R07",
        "R08",
        "R09",
        "R10"
      ],
      "limited_by_input": false,
      "decision": "continue",
      "reason": "هدف برآورده نشد؛ دور بعد روی نسخه‌ی پایه‌ی ۱",
      "best_version_after": 1
    },
    {
      "round": 3,
      "version": 3,
      "base_version": 1,
      "total": 60.0,
      "score10": 6.0,
      "guide_pass": false,
      "target_met": false,
      "veto": [],
      "below_target": [
        "R01",
        "R02",
        "R03",
        "R04",
        "R05",
        "R06",
        "R07",
        "R08",
        "R09",
        "R10"
      ],
      "limited_by_input": false,
      "decision": "continue",
      "reason": "هدف برآورده نشد؛ دور بعد روی نسخه‌ی پایه‌ی ۳",
      "best_version_after": 3
    },
    {
      "round": 4,
      "version": 4,
      "base_version": 3,
      "total": 61.25,
      "score10": 6.125,
      "guide_pass": false,
      "target_met": false,
      "veto": [],
      "below_target": [
        "R01",
        "R02",
        "R03",
        "R04",
        "R05",
        "R06",
        "R07",
        "R08",
        "R09",
        "R10"
      ],
      "limited_by_input": false,
      "decision": "stop_max_rounds",
      "reason": "دور ۴ = سقف ۴؛ بهترین نسخه‌ی ۴ می‌ماند",
      "best_version_after": 4
    }
  ],
  "best_version": 4,
  "state": "stopped",
  "stop_reason": "دور ۴ = سقف ۴؛ بهترین نسخه‌ی ۴ می‌ماند"
}
